{"evaluator":{"implementation_id":"partition_full_mean_squared_l2_v1","source_path":"harness/python/diskann_harness/partition_compactness.py","source_sha256":"448869cbd601ceafa3537c741ffdbfbb5f65e792545078a681e89684c6ba674f","version":"1.0.0"},"execution":{"elapsed_seconds":323.03787001100136,"ended_at":"2026-10-13T09:26:21.898334+00:00","ownership_map_bytes":4000000,"platform":"macOS-13.2.1-x86_64-i386-64bit","python":"3.12.12","started_at":"2026-10-13T09:20:58.853084+00:00"},"input_validation":{"checks":["existing_metadata_schemas","artifact_refs_and_lineage","payload_lengths_and_sha256","aggregate_checksums","native_headers","complete_unique_coverage","nonempty_partitions","declared_mapping_order","finite_vectors_and_optional_centroids","input_stamps_and_sha256_unchanged"],"files":[{"byte_length":898,"path":"/Users/krystal/Desktop/入职材料/Mirage 复现/向量数据库立项材料/0803_diskann_methods/experiments/reports/partition-compactness-sift1m-20261013-k3-01/request.json","sha256":"67e3c441985ab3bc2a823adfdae9363f4326e3962ee813377ba4ee3a58b1766d"},{"byte_length":5205,"path":"/Users/krystal/Desktop/入职材料/Mirage 复现/向量数据库立项材料/0803_diskann_methods/contracts/partition/compactness-v1/evaluation-report.schema.json","sha256":"b29b04a56394f58c21cbc81e00b7c28337034c8eec82c4c8e02655060ed07ab7"},{"byte_length":876,"path":"/Users/krystal/Desktop/入职材料/Mirage 复现/向量数据库立项材料/0803_diskann_methods/build/kmeans-partition-sift1m-20261013-k3-01/workspace/normal/datasets/sift1m/artifact.json","sha256":"5e1b85355a63ad56a29f3fdd54a0c94297216791833675b36dab11b38b5cc63e"},{"byte_length":512000008,"path":"/Users/krystal/Desktop/入职材料/Mirage 复现/向量数据库立项材料/0803_diskann_methods/build/kmeans-partition-sift1m-20261013-k3-01/workspace/normal/datasets/sift1m/vectors.bin","sha256":"8c7b3d999ba3133f865af72df078f77c2d248fdb80571d7ea1f1bb8e1750658e"},{"byte_length":2097,"path":"/Users/krystal/Desktop/入职材料/Mirage 复现/向量数据库立项材料/0803_diskann_methods/build/kmeans-partition-sift1m-20261013-k3-01/workspace/normal/kmeans-sift1m-k3-20261013-01/partition/artifact.json","sha256":"b0c6fa27968efc31204d50ff046d9171c21b5415721996cd93bc863f17fd91db"},{"byte_length":999200,"path":"/Users/krystal/Desktop/入职材料/Mirage 复现/向量数据库立项材料/0803_diskann_methods/build/kmeans-partition-sift1m-20261013-k3-01/workspace/normal/kmeans-sift1m-k3-20261013-01/partition/partition-0-map.bin","sha256":"49be95a4efeb4ba0aa275d22a9d5ffda5250aa152393aed1ce0895684eee9dff"},{"byte_length":1058380,"path":"/Users/krystal/Desktop/入职材料/Mirage 复现/向量数据库立项材料/0803_diskann_methods/build/kmeans-partition-sift1m-20261013-k3-01/workspace/normal/kmeans-sift1m-k3-20261013-01/partition/partition-1-map.bin","sha256":"afa28c7630df4b6527add1d13270b1e84e57002cc8daa12649ce5f959d96062c"},{"byte_length":1942444,"path":"/Users/krystal/Desktop/入职材料/Mirage 复现/向量数据库立项材料/0803_diskann_methods/build/kmeans-partition-sift1m-20261013-k3-01/workspace/normal/kmeans-sift1m-k3-20261013-01/partition/partition-2-map.bin","sha256":"15dfbd82289f482dd4425fa22f961e2660003c71fdd34bc65a04ab1758940708"},{"byte_length":1544,"path":"/Users/krystal/Desktop/入职材料/Mirage 复现/向量数据库立项材料/0803_diskann_methods/build/kmeans-partition-sift1m-20261013-k3-01/workspace/normal/kmeans-sift1m-k3-20261013-01/partition/centroids.bin","sha256":"ca3bef623668a8f6a24e07b23aee83df6c4835ccd59dbd38ae30cdee77e43746"}],"scope":"complete_disjoint_native_float32_l2","status":"VALID"},"inputs":{"dataset":{"aggregate_checksum":"4935b25f2cb2af2a05c7a657c3beb9c1823f45d1cf067f1d298169bb721f377e","artifact_type":"dataset","format_version":"diskann-float32-dataset/v1","metadata_path":"datasets/sift1m/artifact.json"},"dataset_content_sha256":"8c7b3d999ba3133f865af72df078f77c2d248fdb80571d7ea1f1bb8e1750658e","dataset_identity":{"dataset_checksum":"8c7b3d999ba3133f865af72df078f77c2d248fdb80571d7ea1f1bb8e1750658e","dataset_id":"sift1m","distance_metric":"l2","global_node_count":1000000,"scalar_type":"float32","vector_dimension":128},"partition":{"aggregate_checksum":"048139c8c8f2661ccbe63ff34973e7489daf53125697fc23f1a5fb4217476449","artifact_type":"partition","format_version":"partition-artifact/v1","metadata_path":"kmeans-sift1m-k3-20261013-01/partition/artifact.json"},"workspace":"/Users/krystal/Desktop/入职材料/Mirage 复现/向量数据库立项材料/0803_diskann_methods/build/kmeans-partition-sift1m-20261013-k3-01/workspace"},"metric_definitions":{"distance":"squared L2; no square root or division by dimension","mean":"mu_j = sum(x for all nodes in partition j) / n_j","overall":"C = sum(n_j * C_j) / sum(n_j); sum(n_j) = dataset node count","per_partition":"C_j = sum(sum_d((x_d - mu_j_d)^2)) / n_j","training_centroids":"validated when present; never used in compactness"},"node_count":1000000,"parameters":{"accumulator":"float64_neumaier_and_math_fsum","batch_rows":4096,"passes":2},"partition_count":3,"partitions":[{"compactness":88736.10920860329,"node_count":249798,"partition_id":0},{"compactness":88773.3604021589,"node_count":264593,"partition_id":1},{"compactness":107276.23088288117,"node_count":485609,"partition_id":2}],"report_version":"partition-compactness/v1","status":"SUCCEEDED","weighted_compactness":97749.21555978415}